{
  "schema_id": "lifeos_worker_hq_review",
  "schema_version": 1,
  "artifact_type": "hq_review",
  "attempt": 1,
  "run_id": "RUN-ADV-20260726-053-R1",
  "worker_id": "maintenance_worker",
  "reviewing_hq": "Maintenance_HQ",
  "report_path": "projects/life-logistics-hq/worker-results/maintenance_worker/RUN-ADV-20260726-053-R1/report-002.json",
  "review_state": "REPAIR_REQUIRED",
  "report_integrity_state": "valid",
  "authority_compliance_state": "compliant",
  "work_verification_state": "unavailable",
  "evidence_checked": [
    "report:projects/life-logistics-hq/worker-results/maintenance_worker/RUN-ADV-20260726-053-R1/report-002.json@80f2bd4ff20189b399d2ae27bbbfce987e676fe2",
    "report-checksum:sha256:0f66a559072b73db3375730f73c2c3ace5f3868c051c3bf4ed2f2704f22e737e",
    "report-creation-commit:d9c8fef05fcb22a28c0aedd8341d186eee24dea6:single-authorized-path",
    "assignment:coordination/boards/engineering.md@2139d0e9d42a54ea3c6d4c2e6a4edc80c96599c9",
    "advisory-index:coordination/ADVISORY_INDEX.md@460600b575f217c3f532ae100903e8d25452c8c8",
    "worker-profile:projects/life-logistics-hq/workers/maintenance_worker.md@200840e28d8b4397d80f0108cb1f5e3064a40ba3",
    "task-procedure:projects/life-logistics-hq/procedures/maintenance_coordinated_repository_repair.md@50e0a09364a063db2ded464ae9315ba479310b66",
    "result-procedure:projects/life-logistics-hq/procedures/maintenance_worker_result_submission.md@56cddd40b3a825511a0a30f2ad3d1b10ece655b6",
    "review-procedure:projects/life-logistics-hq/procedures/maintenance_hq_worker_review_receipt.md@f19d9ce411162ec721a48d31a07905bfdfe03450",
    "rejected-report:projects/life-logistics-hq/worker-results/maintenance_worker/RUN-ADV-20260726-053-R1/report-001.json@555be4707e467844b0c1cfbc13a22d4826eebf79",
    "rejection-artifact:projects/life-logistics-hq/worker-results/maintenance_worker/RUN-ADV-20260726-053-R1/rejection-001.json@a594bac6b9d74bece5970d354cde6d2d1340f901",
    "repair-commit:9d105070713c97e3137d357171e904b7ff021123:memory/HQ_NAMING_STANDARD.md",
    "repair-commit:b414854441fbfb198c4dff910be8c92da0d2fa00:projects/engineering/open_loops.md",
    "repair-commit:23a95213c79738618c052eeeabc9bccb8047fa54:projects/life-logistics-hq/status.md",
    "repair-commit:f3e6a5f36729c4c4dc40cc994624e93870f3f113:projects/life-logistics-hq/open_loops.md",
    "repair-commit:b17bcf7e3bff47b2f62210b1774fe32b3ae45a41:projects/engineering/status.md",
    "repair-commit:bf763b257cac90063c47466c2806c7c86fbd7dfa:projects/life-logistics-hq/README.md",
    "repair-commit:0cf409d35c96809b512297d615ca27edb3fd3f6c:projects/engineering/README.md",
    "repair-commit:0ee5e88e3c604d9df155431ac962a783cae78aa2:memory/04_ACTIVE_PROJECTS.md",
    "repair-commit:620899d12305a054bd605485efa1756c4ce5988b:projects/main-assistant/status.md",
    "repair-commit:55c0aa8812a22560906fab576c35bacaf56a65e9:memory/01_SESSION_HANDOFF.md",
    "repair-commit:b003bffc2cdf9d231ca899975b059e06e0721115:projects/main-assistant/open_loops.md",
    "hold-source:coordination/WORKER_EXECUTION_CONTRACT.md@95a610c071a5145da9337934a30169b404f49022",
    "hold-source:projects/life-logistics-hq/SESSION_HANDOFF.md@849e3bf5fdbdbcbf0835a4ee8627290dffa33bf8",
    "hold-source:projects/engineering/SESSION_HANDOFF.md@65b9588f89e88e0df86dbf755b11e3cef6de0cfe",
    "hold-source:projects/main-assistant/SESSION_HANDOFF.md@7a9ab33d1310a91317953c11b9d21363f931f133",
    "review-procedure-conflict:VERIFIED-requires-read-only-audit-and-no-repair"
  ],
  "reason": "The immutable attempt-2 report is valid, assignment-correlated, and authority-compliant. The eleven reported repair commits and four held long-form records were independently inspected, and the correction did not re-execute or broaden the underlying work. However, the registered maintenance_hq_worker_review_receipt version 1 permits VERIFIED only when a read-only audit stayed inside the profile and no repair occurred. ADV-20260726-053 authorized and performed bounded repository repairs, so VERIFIED cannot be issued without broadening the review procedure. A separately authorized localized procedure correction or write-capable HQ review path is required; the Worker report, repair commits, holds, and source advisory must not be overwritten, re-executed, or closed by this receipt.",
  "ready_for_consumption": false,
  "requires_rob_validation": false
}
